{"allowed_files":["docs/sscm-repair-dogfood.txt"],"authority":"NONE","commit_required":true,"expected_content":{"docs/sscm-repair-dogfood.txt":"SSCM_REPAIR_SEED\n"},"mission_id":"mission-sscm-01c-live-1","notes":"Scope is strictly bounded to the single allowed file. Do not touch .gitignore, README, CI config, or any other path. Do not force-push, rebase, amend, or rewrite history. Do not merge to any shared branch; leave the commit on the isolated implementer branch for host-side verification. Use a plain LF line ending. A suggested commit subject is \"docs: add SSCM repair dogfood seed file\". This instruction grants no authority beyond the stated file and commit.","objective":"Create the file docs/sscm-repair-dogfood.txt containing exactly one line, SSCM_REPAIR_SEED, terminated by a single trailing newline (file bytes: \"SSCM_REPAIR_SEED\\n\", 17 bytes, no BOM, no carriage return). Create the docs/ directory only if it does not already exist. Stage and commit the file on the implementer's isolated branch as a single commit. No other file may be created, modified, or deleted, and no existing commits may be rewritten.","role":"COORDINATOR","schema_version":"sovereign.sscm-coordinator-instruction.v0.1","target_role":"IMPLEMENTER","task_id":"task:implement","verification_requirements":["On the host, `git status --porcelain` on the implementer branch prints nothing after the commit (clean working tree, nothing unstaged or untracked).","On the host, `git diff --name-only <base>..HEAD` lists exactly one path: docs/sscm-repair-dogfood.txt.","On the host, `git diff --stat <base>..HEAD` shows 1 file changed, 1 insertion(+), 0 deletions(-).","On the host, `git show HEAD:docs/sscm-repair-dogfood.txt | od -c` yields the bytes S S C M _ R E P A I R _ S E E D \\n and nothing else (17 bytes; `git show HEAD:docs/sscm-repair-dogfood.txt | wc -c` prints 17).","On the host, `git show HEAD:docs/sscm-repair-dogfood.txt | sha256sum` matches `printf 'SSCM_REPAIR_SEED\\n' | sha256sum`.","On the host, `git rev-list --count <base>..HEAD` prints 1 (exactly one new commit on the implementer branch).","On the host, `git log -1 --format=%s` on the implementer branch shows a non-empty commit subject referencing the dogfood seed file."]}
