{"allowed_files":["docs/sscm-dogfood.txt"],"authority":"NONE","commit_required":true,"expected_content":{"docs/sscm-dogfood.txt":"SOVEREIGN_SSCM_OK\n"},"mission_id":"mission-sscm-01a-live-4","notes":"Coordinator holds no authority; this instruction grants none. Scope is strictly bounded to the single allowed file. Any deviation (extra files, altered content, multiple commits, history rewrite, or dirty worktree) constitutes verification failure. Use a plain commit message such as \"docs: add SSCM dogfood marker\". No tools were run by the coordinator in producing this instruction.","objective":"On your isolated implementer branch, create the file docs/sscm-dogfood.txt whose entire content is the single line SOVEREIGN_SSCM_OK followed by exactly one trailing newline (byte-exact: \"SOVEREIGN_SSCM_OK\\n\", 18 bytes, no BOM, no carriage return, no leading or trailing whitespace). Create the docs/ directory if it does not already exist. Stage only this file and commit it in a single commit on the isolated branch. Do not create, modify, delete, rename, or reformat any other file, and do not touch any other branch or the base branch. Do not push, merge, tag, or rewrite history. After committing, the worktree must be clean.","role":"COORDINATOR","schema_version":"sovereign.sscm-coordinator-instruction.v0.1","target_role":"IMPLEMENTER","task_id":"task:implement","verification_requirements":["Changed file set: on the host, `git diff --name-status <base>..<implementer-branch>` must list exactly one entry, `A\tdocs/sscm-dogfood.txt`, and nothing else.","Exact content: on the host, `git show <implementer-branch>:docs/sscm-dogfood.txt | xxd` must equal the hex of the 18 bytes \"SOVEREIGN_SSCM_OK\\n\" (ends in 0a, no 0d, no BOM); equivalently `git show <implementer-branch>:docs/sscm-dogfood.txt | sha256sum` must match the sha256 of `printf 'SOVEREIGN_SSCM_OK\\n'`.","Clean worktree: on the host, `git -C <implementer-worktree> status --porcelain` must produce empty output (no staged, unstaged, or untracked changes remaining).","Descent from base: on the host, `git merge-base --is-ancestor <base> <implementer-branch>` must exit 0, and `git rev-list --count <base>..<implementer-branch>` must equal 1 (exactly one new commit).","Blob mode: `git ls-tree <implementer-branch> docs/sscm-dogfood.txt` must show mode 100644 (regular, non-executable file).","No other refs touched: base branch tip SHA must be unchanged from before the task, and no new tags or additional branches may have been created by the implementer."]}
